{
  "$schema": "https://json-schema.org/draft/2020-12/schema",
  "title": "Abertura de uma edição, escrita pelo orquestrador",
  "type": "object",
  "additionalProperties": false,
  "required": ["edicao", "titulo", "abertura", "ordem", "conceitos_novos"],
  "properties": {
    "edicao": {"type": "string", "pattern": "^\\d{4}-\\d{2}-\\d{2}$"},
    "titulo": {"type": "string", "minLength": 5, "maxLength": 70},
    "abertura": {"type": "string", "minLength": 40, "maxLength": 900},
    "ordem": {"type": "array", "minItems": 1, "items": {"type": "string", "minLength": 11, "maxLength": 11}},
    "conceitos_novos": {"type": "array", "items": {"type": "string"}}
  }
}
