{
  "edicao": "2026-09-27",
  "titulo": "O dia das fábricas de software",
  "abertura": "Dez talks sobre o que acontece quando agentes escrevem quase todo o código. Metade discute a tal fábrica de software: o que ela é, o que falta nela e se o nome faz sentido. A Greptile traz dados de um milhão de pull requests por mês, e a Z.ai apresenta um modelo aberto quase no nível dos melhores. Comece pelos dados e termine na visão de produto do Google.",
  "ordem": [
    "474j-n1Ltxc",
    "9JFGohx4E7U",
    "TRfzFJCJ7ZE",
    "YIVkERhy8xo",
    "tUPPVhBBcoM",
    "HvboD89DyQ8",
    "vGCJ7diEtrw",
    "6MudaeKdBSk",
    "TN3mj92oZ8I",
    "buHC7bQE1X4"
  ],
  "conceitos_novos": [
    "Compactação de contexto",
    "Control plane",
    "Deferred context",
    "Harness",
    "Memory layer",
    "N+1 query",
    "Pareto efficiency",
    "Rollout",
    "Sample ratio mismatch",
    "Sidecar",
    "Skill loop"
  ]
}
