{
  "edicao": "2026-10-27",
  "titulo": "Agentes em produção: controle, sandbox e testes reais",
  "abertura": "Onze talks sobre o que acontece quando agentes saem do protótipo. O dia começa pela governança: tratar agente como funcionário, aprender com um erro bancário de 900 milhões de dólares e ver o que uma empresa de 60 pessoas descobriu ao vigiar seus 300 agentes. Depois vem a construção: o harness que sobreviveu a dois anos de reconstrução, o sandbox no lugar de dezenas de ferramentas e os agentes gerenciados na nuvem do Google. Em seguida, dois casos aplicados, revisão de código e agentes de voz, antes de fechar com testes em tarefas reais, um loop que melhora o agente sozinho e a plataforma que leva modelos novos aos traders no mesmo dia.",
  "ordem": [
    "h8jgniNJcbQ",
    "iniryju23Sk",
    "BgLdvF7Qkh8",
    "YIhvrvHtonk",
    "dAoOYFx7ZYw",
    "Y_p3y6zP5QE",
    "4UtrRVtUN_g",
    "OmyqelTwpOo",
    "kRJjSOYqW0I",
    "UGuNt2_Oz8s",
    "aGIUg8zKI8A"
  ],
  "conceitos_novos": [
    "Classificador de aprovação",
    "ATIF"
  ]
}
