{
  "edicao": "2026-10-25",
  "titulo": "IA nas finanças, evals e o novo trabalho do engenheiro",
  "abertura": "Edição grande, com 24 talks, quase todos ligados a finanças. Ela começa pelo que sobra para o engenheiro quando o código fica barato e por como medir o retorno da IA num fundo. Depois vem um bloco de evals: do primeiro juiz LLM a testes sem benchmark público e à taxonomia de 1.368 falhas reais. Em seguida, Bridgewater, Kepler e turbopuffer mostram como buscar em documentos privados sem inventar números nem vazar permissões, e agentes de longo prazo, de navegador e com identidade própria entram no negócio. O dia fecha com o mercado de GPUs e com o transformer que a Wells Fargo treinou sobre transações para pegar fraude.",
  "ordem": [
    "kspZP5BgkEU",
    "Ve2bAarPA2I",
    "ImnZ7s68jw8",
    "opHmX7qClzE",
    "ZMZlAn6Pyfg",
    "gv4w23xYj-0",
    "c_SPW__jF9w",
    "A3FL_zTQKU0",
    "v5tm5EAzsAs",
    "_dTF3NpPzGo",
    "mMw3arwQsL0",
    "aVbRSIQO2dE",
    "WOszaC1WWbQ",
    "dZgA6btnb_s",
    "CLve4Nx_RwI",
    "u_jvuCjuvEk",
    "oP2WLFpMoDY",
    "DZ24Xbm9Joc",
    "uTrY8slys0w",
    "5O6jLtoeKrg",
    "laQ8wMysnkk",
    "GCse4OMzY8U",
    "Wk2bUUGFC_o",
    "UB6hoWyh3B0"
  ],
  "conceitos_novos": [
    "Decision model",
    "Post-filtering e pre-filtering",
    "Native filtering",
    "Pré-filtragem e pós-filtragem",
    "Unhobbling",
    "Curva a termo (forward curve)",
    "Contango",
    "Decoder-only",
    "Foundation model",
    "RMA",
    "AUC ROC",
    "Contaminação de benchmark"
  ]
}
