{
  "edicao": "2026-10-03",
  "titulo": "Quando o usuário vira agente: interface, memória e infraestrutura",
  "abertura": "Sete talks sobre o que muda quando quem usa o software é um agente. A Composio decreta o fim do dashboard, e um Raspberry Pi pendurado no pescoço mostra um agente pessoal com memória em grafo. A Oracle ensina a decidir onde cada saber mora: prompt, memória ou pesos. O Google DeepMind redesenha a API para agentes com estado no servidor, e o VS Code conta como passou a lançar toda semana refazendo o sistema em volta dos agentes. No fim, a pilha de baixo: Nebius explica como servir modelos abertos rápido e barato, e a Crusoe mostra treino que se cura sozinho quando uma GPU morre.",
  "ordem": [
    "YiFqcu9YA38",
    "oUZEt4EiPbk",
    "qflLT3SoVbw",
    "8aVbXXvJUY4",
    "I2LL_wd89-A",
    "TRe1u7dHYiA",
    "bRGyYaE0lxI"
  ],
  "conceitos_novos": [
    "Cypher",
    "Drift",
    "Thought signatures",
    "Steps data model",
    "Proxy man-in-the-middle",
    "Speculative decoding",
    "Draft model",
    "Prefill e decode",
    "NVFP4",
    "KV cache",
    "Gang scheduling",
    "XID 79",
    "Cordon e drain de nó",
    "Slurm",
    "Kubernetes"
  ]
}
