{
  "edicao": "2026-10-05",
  "titulo": "Medir antes de confiar: evals, traces e o agente em produção",
  "abertura": "Dezoito talks com um fio comum: agente bom é agente medido. Kent C. Dodds abre lembrando que, com implementação barata, o valor está em escolher o que construir. OpenAI e WorkOS mostram como transformar pedidos ao agente em processo verificável, e PayPal, Docker e E2B tratam de pagamento, credenciais e sandbox. O bloco central é sobre evals: Arize, Braintrust, IBM e Browserbase ensinam a ler traces, calibrar juízes de LLM contra humanos e desconfiar de verificadores que aprovam o que falhou. A Modal fecha abrindo o motor de inferência, do scheduler ao KV cache.",
  "ordem": [
    "_fHTqOs5wQA",
    "s0hFne6EeOI",
    "FwiS44-xyYw",
    "AgBAOXVxt4A",
    "zQZiHOpkq_s",
    "c5U-XbbEN-g",
    "fz6-NS7qpZc",
    "ZUZVNKFSmTM",
    "wzWNYDY7toc",
    "9_oy4owGtPI",
    "T3SS931wU0I",
    "qZj7sqmidqA",
    "F0TNSmbo5hE",
    "NdrSPm6NCdk",
    "xLxhT2ZI7UM",
    "hfEczxdNyvU",
    "42Bz0TUfeOQ",
    "woIYJYd_etI"
  ],
  "conceitos_novos": [
    "QAT (quantization-aware training)",
    "Elicitation",
    "Cross App Access (XAA)",
    "Recall",
    "Precision e recall",
    "Signal",
    "Agreement gate",
    "Cohen's kappa",
    "Topics e facets",
    "Remote eval",
    "OpenInference",
    "Time to first token (TTFT)",
    "Scheduler"
  ]
}