{
  "edicao": "2026-10-21",
  "titulo": "Quando escrever código deixa de ser o gargalo",
  "abertura": "Cinco talks sobre o que muda quando produzir ficou barato. Cerebras e OpenAI abrem com um sistema de agentes para criar vídeo, em que a IA faz o trabalho chato e o criador mantém a voz. A Capital One explica quando qualidade de código ainda importa: pouco no software descartável, muito no durável. Vanguard e GEICO mostram como modernizar sistemas legados, uma expondo o código antigo via MCP e a outra reunindo especialistas e frotas de agentes numa sala por um dia. A MiniMax fecha ensinando a medir se um modelo mais rápido entrega o trabalho inteiro mais rápido.",
  "ordem": [
    "CFbnVpSsDFQ",
    "bU5gDVyu_28",
    "uA4ah-dVHvU",
    "DouK81O8R3o",
    "YvQ4BVTWfHI"
  ],
  "conceitos_novos": []
}
