{
  "edicao": "2026-10-08",
  "titulo": "Contexto, confiança e memória para agentes em produção",
  "abertura": "Esta edição sai do protótipo e entra na rotina de uma empresa que usa agentes de verdade. Começa pelas pessoas e pela plataforma: como dar tempo para o time aprender e como deixar qualquer um publicar um app interno com segurança. Depois vem o contexto que o agente precisa enxergar, do mapa de APIs à telemetria de produção, e como validar o que ele entrega com PRs revisados por agentes, evals guiados pelo cliente e ferramentas MCP mais enxutas. Fecha com arquitetura e memória: separar quem planeja de quem executa e transformar experiência em lições e skills que o agente reaproveita.",
  "ordem": [
    "3XI90A3ENSg",
    "HTzgC3FoYsI",
    "YNT7Plf9KIg",
    "k2ClBT4aqAg",
    "uuwDWRbxoYo",
    "Emo5FGGY-wM",
    "jJQoVkd5yLg",
    "NaOkR3VSfR4",
    "KGFyOtl5ktI",
    "XPj3mIKEtI4"
  ],
  "conceitos_novos": [
    "Análise de programa",
    "Saga de ligação tardia",
    "Sleep-time compute"
  ]
}
