{
  "edicao": "2026-10-04",
  "titulo": "Agentes no mundo real: catálogo, suporte, código e espera",
  "abertura": "Cinco talks sobre o que acontece quando o agente sai da demo e encontra sistemas de verdade. O PayPal mostra por que catálogos feitos para palavra-chave confundem agentes de compra, e a AssemblyAI conta como um agente próprio de suporte saltou de 10% para 80% de tickets resolvidos. A Sourcegraph olha para quem cuida de dezenas de milhares de repositórios e defende visibilidade do código como infraestrutura. A AWS mostra um agente que escreve as próprias ferramentas em tempo de execução, e a Temporal fecha com o agente que precisa esperar dias por um humano sem perder o estado.",
  "ordem": [
    "YXb2Wx1r_Pk",
    "pyvRID_CZZU",
    "Bdrs3uAX0_M",
    "33Oct2hqGnk",
    "jc3kbZkuHTo"
  ],
  "conceitos_novos": [
    "Replay de event history",
    "Determinismo em workflows"
  ]
}
