{
  "edicao": "2026-09-23",
  "titulo": "Visão e documentos: o que o modelo realmente enxerga",
  "abertura": "Oito talks sobre como a IA lê imagens, vídeos e PDFs. O fio comum: modelos grandes reconhecem bem, mas raciocinam mal sobre o que veem, e o ganho vem de preparar a entrada e treinar modelos menores com dados bem escolhidos. Comece pelo caso prático das fazendas e pelos PDFs, depois siga para o treino de modelos de visão e robótica.",
  "ordem": [
    "ztlXKfPCT3Q",
    "RQi7x-navxU",
    "0I07YAuF8xA",
    "A_I8mw8yfns",
    "dKcTBQzR7jI",
    "jNE8No-wvok",
    "T72nqdC92PM",
    "ZZcE0HeO-Hc"
  ],
  "conceitos_novos": [
    "Acordo mínimo versus consenso",
    "Agentic OCR",
    "Complexidade quadrática da atenção",
    "Currículo de treino",
    "DPO",
    "Early fusion",
    "Embodied reasoning",
    "Image-guided detection",
    "Knowledge distillation",
    "LLM-as-a-judge",
    "mAP",
    "Mixture of experts",
    "Modality misalignment",
    "Multi-agent system",
    "Object detection",
    "Ortomosaico de drone",
    "Quantization",
    "RLVR",
    "SFT e RL",
    "State Space Model (SSM)",
    "Synthetic data flywheel",
    "Visual chain of thought",
    "VLA",
    "VLM",
    "World model"
  ]
}
