{
  "edicao": "2026-09-24",
  "titulo": "Robôs no mundo real: dados, corpo e confiabilidade",
  "abertura": "Seis talks de IA física. Todos esbarram no mesmo muro: robôs têm pouco dado e um demo bonito esconde a taxa de erro. Você vai ver como achar vídeo útil na web, como medir confiabilidade com um modelo de recompensa e por que world models precisam entender causa e efeito além de gerar imagens bonitas.",
  "ordem": [
    "jgWY66RaSrQ",
    "I_VEh7XSwyc",
    "2wgPHvW0mG8",
    "Sjfz1TqxzEs",
    "jFHteJjRl8A",
    "4Gqg0HVe-AY"
  ],
  "conceitos_novos": [
    "Action-conditioned world model",
    "End-to-end learning",
    "Neuro-simbólico",
    "World action model",
    "Zero-shot transfer"
  ]
}
