{
  "edicao": "2026-09-26",
  "titulo": "Agentes que melhoram a si mesmos",
  "abertura": "Sete talks sobre fechar o ciclo: o agente roda, é medido, aprende com o erro e roda de novo. A Weights & Biases mostra agentes que viram laboratório de si mesmos, o GEPA troca aprendizado por reforço por reflexão em texto e a Prime Intellect coloca agentes de código para competir com pesquisadores. Leia na ordem, do conceito de loop até a otimização de GPU.",
  "ordem": [
    "7taOQBfjDyE",
    "x4e5O9zN0TE",
    "hd7TOvmyAxU",
    "XyV6bSMyq-I",
    "OA-Mc60Rboo",
    "oVsEddfhdxc",
    "vrDvatGtIxs"
  ],
  "conceitos_novos": [
    "AlphaEvolve",
    "Autoresearch",
    "CUDA graphs",
    "GPU kernel",
    "GRPO",
    "Hiperparâmetro",
    "MFU",
    "Multi-armed bandit",
    "Optimizer",
    "Otimização de prompt",
    "Policy surface",
    "Preemptible job",
    "Profiler",
    "Recursive self-improvement",
    "Reinforcement learning",
    "Sim-to-real gap",
    "Speedrun"
  ]
}
