{
  "edicao": "2026-10-12",
  "titulo": "Agentes em produção: segurança, contexto e inferência",
  "abertura": "Edição grande, com 57 talks da conferência AI Engineer. Ela começa por negócio e equipes, passa pela série da Anthropic sobre Claude Managed Agents e por agentes que melhoram sozinhos lendo os próprios traces e evals. Depois vem o bloco mais longo, sobre segurança: credenciais curtas, sandboxes e a lethal trifecta, quando o agente junta dados privados, conteúdo externo e acesso à internet. O fim cobre busca híbrida e GraphRAG para dar contexto ao agente, os truques de inferência que deixam o mesmo modelo mais rápido e como a MiniMax treinou o M3 com atenção esparsa.",
  "ordem": [
    "snTZtttfL70",
    "T3wRyXg_yVg",
    "gpmze-6ueGU",
    "EEt3ZSG4a1s",
    "oixzVKMAXG0",
    "PwCSYy-oGsM",
    "mBNVKkyfnE0",
    "nSkmXakJ6eo",
    "aV_vgUSatqs",
    "ZGzthw4BZiA",
    "rAUyRDOFyHU",
    "YXiLj4tJt5A",
    "b9UhZkKjX_A",
    "Uv0nAf_7tyU",
    "FGftGOzfohc",
    "qJtcEDc_WJU",
    "QSeaZ6qHyXs",
    "p7gaxmCUiIU",
    "fnuNVFgLjHA",
    "_zUp6y9bDU8",
    "BOCjybvJYM4",
    "YIxzNZDDy1A",
    "tyFPqtyOK5w",
    "7RFJRDYroic",
    "-AKPRSYccJc",
    "bI8WyG9YB0I",
    "ojJXgXLUQFc",
    "abw_m-DRi1k",
    "ws9XcGGPBDk",
    "iH_wV8BbS24",
    "k72eLcYpVys",
    "xn8EsW0wxyc",
    "1tpqdglI3T0",
    "7v2myBde05o",
    "ZyC56eV8sVw",
    "p-2MT8KYZqU",
    "xfPVBzDYjH4",
    "j4AmIK6OvHc",
    "HGfsfKaVuGY",
    "IK8cC4FScps",
    "Fa3hQVIKShw",
    "ksjwtQop4os",
    "LJ2a9nX3vlo",
    "spxoDAfh5ig",
    "ORVh4GivEU0",
    "KhRjivBSwiw",
    "qFaKvbVc5cE",
    "s-glGHAa1a4",
    "XczFLWEntiE",
    "Zf_e45GiNCE",
    "Ndp5VaqFrl0",
    "13YZ1EB9hjU",
    "_naLJOqVOEI",
    "_cRgl3maiT8",
    "4n08JHb90hI",
    "7BcQdtRA3Tc",
    "htod7Nv1cBc"
  ],
  "conceitos_novos": [
    "Failure surface",
    "Codon",
    "Token exchange",
    "Security token service (STS)",
    "Intent based authorization",
    "Dreaming",
    "SPF, DKIM e DMARC",
    "ID-JAG",
    "Paged KV cache",
    "Disaggregation",
    "Continuous batching",
    "Seccomp",
    "eBPF",
    "Container escape",
    "Reinforcement fine-tuning (RFT)",
    "Dilema estabilidade-plasticidade",
    "Mojo",
    "CUDA",
    "Bits per byte (BPB)",
    "Hierarquia de cache",
    "Taint analysis",
    "JSONPath",
    "Admission controller",
    "Runtime security",
    "Split key custody",
    "Trusted execution environment (TEE)",
    "Agent experiments",
    "Tool poisoning",
    "Slopsquatting",
    "Combinação linear",
    "Resolução de símbolos",
    "pass@k e pass^k",
    "LoRA",
    "Hot swapping de modelos",
    "Tailnet e tsnet",
    "Sparse attention",
    "GQA (grouped-query attention)",
    "Continued pre-training (CPT)",
    "Vision transformer (ViT)",
    "JWT",
    "Memory snapshot"
  ]
}