{
  "edicao": "2026-10-17",
  "titulo": "Agentes que mexem com dinheiro precisam de limites e provas",
  "abertura": "Quatro talks sobre o que falta para confiar num agente quando há dinheiro ou conta de cliente em jogo. Um painel com Keycard, JPMorgan Chase e o coautor do OAuth explica por que permissões amplas falham e propõe missão, orçamento e um proxy de saída fora do agente. Dois engenheiros do Monzo mostram como um harness com conta em código e dado com origem gera análise financeira confiável. Depois vem um workshop de evals que ensina a ler traces e a testar o próprio juiz, e a edição fecha com a anatomia de um harness com memória aplicado à detecção de lavagem de dinheiro.",
  "ordem": [
    "IavxrdVnwXM",
    "e9-br9hveRI",
    "SHMCGrNJJGc",
    "KtBivPzmOM8"
  ],
  "conceitos_novos": [
    "Egress proxy"
  ]
}
