{
  "edicao": "2026-10-02",
  "titulo": "Agentes fora do demo: segurança, custo e verificação",
  "abertura": "Dez talks sobre o que acontece quando agentes saem da demonstração e entram no dia a dia. A Docker mostra por que o limite de segurança precisa ficar numa microVM, e a Qdrant defende guardar a memória do assistente em casa. Cast AI, Exa e Apify tratam do harness: escolher o modelo por tarefa, buscar na web com regra clara e carregar ferramentas MCP sem inchar o contexto. Depois vem a verificação: Meticulous, Datadog, Traversal e Browserbase mostram como saber se o código e o agente acertaram em produção. No fim, a DatologyAI conta a engenharia por trás de 12 trilhões de tokens sintéticos.",
  "ordem": [
    "OE_lLNCNfQo",
    "apyrzaWj0Z4",
    "48YUYDjwfYY",
    "cKhpeEBnT1o",
    "pAnLpiAG6Es",
    "HLTa7Vcs4X0",
    "rTojoVotlD8",
    "y-OVWZD4j6U",
    "5xi_S1f9sDU",
    "FQwTqUmcbRg"
  ],
  "conceitos_novos": [
    "Delegation chain",
    "Cedar policy",
    "HNSW",
    "Code Mode",
    "Production world model",
    "Idempotência",
    "Bin packing",
    "Rephrasing",
    "Checkpointing",
    "Batch inference"
  ]
}
