{
  "edicao": "2026-10-19",
  "titulo": "Quando confiar no agente: checagem, teste no passado e troca de modelo",
  "abertura": "Seis talks sobre como saber se um agente merece confiança. A edição abre com a Long Lake, que compra empresas de serviços para implantar IA por dentro, e com o Coinbase, que libera a autonomia do agente em três estágios conforme a checagem prova que funciona. Depois, um engenheiro de harness explica o que sobra para o harness quando o modelo aprende sozinho. Pamela Fox troca quatro modelos no mesmo app e mostra por que benchmark não substitui eval. A edição fecha com dois talks da Exa sobre backtest: testar o agente contra a web como ela era, sem vazar o futuro e sem cair em overfitting.",
  "ordem": [
    "J7n3WJnFTto",
    "_4Ph2dhmUFI",
    "7Y4sbZgBdnc",
    "UGjk3Uk0MxM",
    "vS2IA9pq0Q4",
    "L4dUFimVDKU"
  ],
  "conceitos_novos": []
}
