{
  "edicao": "2026-10-18",
  "titulo": "Custo, contrato e prova para agentes saírem da demo",
  "abertura": "Seis talks sobre o que separa um agente de demonstração de um agente que roda no dia a dia. A edição começa pelo dado bagunçado dos sinistros de seguro e pelo motivo de os protocolos de pagamento para agentes ainda não terem volume. Depois vem a conta: como medir e cortar o gasto com tokens escolhendo o modelo certo para cada tarefa. Em seguida, a OpenProse mostra como descrever o resultado num contrato em markdown em vez de ditar o passo a passo. A edição fecha com dois talks de verificação: fazer o agente de código provar que terminou e montar evals com dataset de especialista e um gate de CI (integração contínua) que barra mudança de prompt quando a nota cai.",
  "ordem": [
    "W4pnzOURwHQ",
    "-AOxpwVeIWw",
    "Ti-BmGU1_mQ",
    "7T-gldvgfpo",
    "q4WC4TowkBo",
    "obfPzbapMIM"
  ],
  "conceitos_novos": [
    "DSPy",
    "DAG de contratos"
  ]
}
