{
  "edicao": "2026-10-09",
  "titulo": "Agentes precisam de regras, memória e dados bem servidos",
  "abertura": "Os talks deste dia olham para o que fica em volta do modelo. Primeiro, a revisão humana e as regras codificadas em lint e testes que seguram a qualidade do código gerado. Depois, como dar ao agente ferramentas enxutas, um harness pronto, memória de verdade e um grafo de contexto da empresa. No fim, dois casos de treino mostram que um modelo pequeno bem treinado vence um gigante e que GPU ociosa costuma ser problema de pipeline de dados.",
  "ordem": ["6qkzlT962es", "E3KbFLAGD6A", "3wj6sgbi1YA", "9WiBJRO84yY", "BIhiYL4U9_M", "cSz7aL2nl2U", "TyPpSRXGhbc", "tNAV259UhCM"],
  "conceitos_novos": ["Complexidade ciclomática", "Ablation study", "Wait-time ratio", "GIL (global interpreter lock)", "Ray actors", "Prefetching", "Object store e zero-copy"]
}
