{
  "edicao": "2026-10-30",
  "titulo": "Agentes que lembram, pagam e erram: onde pôr os guardas",
  "abertura": "Seis talks sobre o que muda quando o agente passa a decidir sozinho. O dia começa por gestores de fundos explicando por que a IA sobe o piso sem substituir o analista, e por um eval que mostra como o modelo barato pode sair caro. Depois vêm contexto e memória: como entregar ao agente de código o mapa do projeto e como decidir o que ele deve guardar. No fim, a segurança: seis ataques a pagamentos x402 feitos por agentes e o novo cenário em que o exploit chega antes do patch.",
  "ordem": [
    "y2dyD6slKxE",
    "rWtbOgl5FTU",
    "8vDzncmzxyg",
    "qq2Hm4XNRgI",
    "YU1uD_YkpjU",
    "xZX3pmaB8Hk"
  ],
  "conceitos_novos": [
    "SLSA e Sigstore"
  ]
}
